{
  "$schema": "http://json-schema.org/draft-07/schema#",
  "$id": "https://github.com/yokoyama-lab/analysis-at-home/work-units/schema.json",
  "title": "analysis@home work unit",
  "type": "object",
  "additionalProperties": false,
  "required": ["id", "title", "statement_informal", "claim_kind", "targets", "prompt_template", "status"],
  "properties": {
    "id": {
      "type": "string",
      "pattern": "^[a-z0-9]+(-[a-z0-9]+)*$",
      "description": "Stable kebab-case identifier; must match the directory name."
    },
    "title": { "type": "string", "minLength": 1 },
    "statement_informal": { "type": "string", "minLength": 1 },
    "domain": { "type": "string" },
    "kind": {
      "type": "string",
      "enum": ["theorem", "leaf", "assembly"],
      "description": "theorem: a whole self-contained theorem (default if absent). leaf: one lemma in a decomposition. assembly: the glue proving the main theorem from leaf lemmas."
    },
    "difficulty": {
      "type": "integer",
      "minimum": 1,
      "maximum": 5,
      "description": "Estimated effort to one-shot (1 = trivial arithmetic/inversion … 5 = hard core). Lets contributors pick what they can finish."
    },
    "depends_on": {
      "type": "array",
      "items": { "type": "string" },
      "description": "Ids of leaves whose STATEMENTS this unit may assume (not their proofs). Used to order assembly and to build a leaf's self-contained prompt."
    },
    "claim_kind": {
      "type": "string",
      "enum": [
        "correctness",
        "complexity",
        "closed-form",
        "worst-case",
        "best-case",
        "expected-cost",
        "distribution",
        "limit-law"
      ],
      "description": "correctness: the algorithm computes the right answer. complexity/closed-form: an asymptotic or exact cost bound. worst-case/best-case: a tight upper/lower bound over all inputs of size n. expected-cost: the exact mean cost under a stated input distribution (the verify-track twin of a conjectured E[cost(n)]). distribution/limit-law: the exact (or limiting) law of the cost — these are computed on the CONJECTURE track and only the provable consequences (e.g. the mean) are promoted to theorems."
    },
    "analysis": {
      "type": "object",
      "additionalProperties": false,
      "description": "Which case is analysed and, for average/distribution/limit claims, the input distribution it is taken over. Required for best/worst/expected/distribution/limit kinds.",
      "required": ["case"],
      "properties": {
        "case": {
          "type": "string",
          "enum": ["worst", "best", "average", "distribution", "limit"],
          "description": "worst/best: extremal over inputs of size n. average: mean over the input distribution. distribution: the full law of the cost. limit: the limiting law of the standardized cost as n grows."
        },
        "input_distribution": {
          "type": "string",
          "description": "The distribution inputs are drawn from, e.g. \"uniform present target in {1..n}\" or \"uniformly random permutation of n elements\". Omit for worst/best (extremal cases need no distribution)."
        },
        "conjecture_artifact": {
          "type": "string",
          "description": "Path (repo-relative) to the conjecture-track result this claim is the verified twin of, e.g. tools/conjecture/results/linear-search.json."
        }
      }
    },
    "targets": {
      "type": "array",
      "minItems": 1,
      "uniqueItems": true,
      "items": { "type": "string", "enum": ["rocq", "lean", "agda", "isabelle"] }
    },
    "prompt_template": { "type": "string" },
    "expected_theorem": {
      "type": "string",
      "description": "Name of the identifier a submission must prove with no axioms (checked by the verifier via Print Assumptions). For now a single canonical name shared across backends."
    },
    "cost_model": {
      "type": "object",
      "additionalProperties": false,
      "required": ["kind", "counts"],
      "description": "How a step is costed. Required for complexity/closed-form claims.",
      "properties": {
        "kind": {
          "type": "string",
          "enum": ["func-ops", "while-ops", "riscv", "llvm"],
          "description": "func-ops: operation count on a functional core; while-ops: operation count on a WHILE imperative core; riscv/llvm: concrete-cost layers."
        },
        "counts": {
          "type": "array",
          "minItems": 1,
          "items": { "type": "string" },
          "description": "Designated operations counted as unit cost, e.g. [\"comparison\"], [\"key-comparison\"], [\"multiplication\"]."
        },
        "notes": { "type": "string" }
      }
    },
    "references": {
      "type": "array",
      "items": { "type": "string" }
    },
    "status": {
      "type": "object",
      "minProperties": 1,
      "additionalProperties": {
        "type": "string",
        "enum": ["open", "submitted", "verified"]
      }
    }
  },
  "allOf": [
    {
      "if": {
        "properties": {
          "claim_kind": {
            "enum": ["complexity", "closed-form", "worst-case", "best-case", "expected-cost", "distribution", "limit-law"]
          }
        },
        "required": ["claim_kind"]
      },
      "then": { "required": ["cost_model"] }
    },
    {
      "if": {
        "properties": {
          "claim_kind": {
            "enum": ["worst-case", "best-case", "expected-cost", "distribution", "limit-law"]
          }
        },
        "required": ["claim_kind"]
      },
      "then": { "required": ["analysis"] }
    }
  ]
}
