{
  "id": "prefix-match-comparisons",
  "title": "Pattern match at a position uses at most |pattern| comparisons",
  "statement_informal": "Comparing a pattern against a text position uses at most |pattern| comparisons (stops at the first mismatch).",
  "domain": "string-matching",
  "claim_kind": "worst-case",
  "analysis": {
    "case": "worst"
  },
  "targets": [
    "rocq",
    "lean",
    "agda",
    "isabelle"
  ],
  "prompt_template": "prompt-template.md",
  "expected_theorem": "prefix_match_comparisons",
  "cost_model": {
    "kind": "func-ops",
    "counts": [
      "comparison"
    ],
    "notes": "One character comparison per matched position; the basis of naive search."
  },
  "references": [
    "Knuth, TAOCP Vol. 3 §6 — naive string matching."
  ],
  "status": {
    "rocq": "verified",
    "lean": "open",
    "agda": "open",
    "isabelle": "open"
  }
}
