{
  "id": "list-in-map",
  "title": "map preserves membership",
  "statement_informal": "If x is in l then f x is in map f l.",
  "domain": "lists",
  "claim_kind": "correctness",
  "targets": [
    "rocq",
    "lean",
    "agda",
    "isabelle"
  ],
  "prompt_template": "prompt-template.md",
  "expected_theorem": "list_In_map",
  "references": [
    "Knuth, TAOCP Vol. 1 §2.2 — list processing."
  ],
  "status": {
    "rocq": "verified",
    "lean": "open",
    "agda": "open",
    "isabelle": "open"
  }
}
