{
  "id": "amgm-four-ab",
  "title": "4ab <= (a+b)^2",
  "statement_informal": "AM-GM: four times the product is at most the squared sum.",
  "domain": "arithmetic",
  "claim_kind": "correctness",
  "targets": [
    "rocq",
    "lean",
    "agda",
    "isabelle"
  ],
  "prompt_template": "prompt-template.md",
  "expected_theorem": "amgm_four_ab",
  "references": [
    "Knuth, TAOCP Vol. 1 §1.2 — mathematical preliminaries."
  ],
  "status": {
    "rocq": "verified",
    "lean": "open",
    "agda": "open",
    "isabelle": "open"
  }
}
