{
  "id": "sum-of-squares",
  "title": "Sum of squares: 1^2+...+n^2 = n(n+1)(2n+1)/6",
  "statement_informal": "The sum of the first n squares equals n(n+1)(2n+1)/6.",
  "domain": "summation",
  "claim_kind": "closed-form",
  "targets": [
    "rocq",
    "lean",
    "agda",
    "isabelle"
  ],
  "prompt_template": "prompt-template.md",
  "expected_theorem": "sum_of_squares",
  "cost_model": {
    "kind": "func-ops",
    "counts": [
      "addition"
    ],
    "notes": "Stated without division as 6*sumsq = n(n+1)(2n+1)."
  },
  "references": [
    "Knuth, TAOCP Vol. 1 §1.2.3 — sums of powers."
  ],
  "status": {
    "rocq": "verified",
    "lean": "open",
    "agda": "open",
    "isabelle": "open"
  }
}
