{
  "id": "odd-plus-odd-even",
  "title": "Odd + odd = even",
  "statement_informal": "The sum of two odd numbers is even.",
  "domain": "number-theory",
  "claim_kind": "correctness",
  "targets": [
    "rocq",
    "lean",
    "agda",
    "isabelle"
  ],
  "prompt_template": "prompt-template.md",
  "expected_theorem": "odd_plus_odd_even",
  "references": [
    "Knuth, TAOCP Vol. 1 §1.2 — mathematical preliminaries."
  ],
  "status": {
    "rocq": "verified",
    "lean": "open",
    "agda": "open",
    "isabelle": "open"
  }
}
