{
  "id": "n-le-square",
  "title": "n <= n^2",
  "statement_informal": "Every n is at most its square.",
  "domain": "arithmetic",
  "claim_kind": "correctness",
  "targets": [
    "rocq",
    "lean",
    "agda",
    "isabelle"
  ],
  "prompt_template": "prompt-template.md",
  "expected_theorem": "n_le_square",
  "references": [
    "Knuth, TAOCP Vol. 1 §1.2 — mathematical preliminaries."
  ],
  "status": {
    "rocq": "verified",
    "lean": "open",
    "agda": "open",
    "isabelle": "open"
  }
}
